A1: 序号 | B1: 单位 | C1: 2008年8月 | D1: 2008年9月 | E1: 2008年10月 | F1: 2008年11月 | G1: 2008年12月
A2: 1 | B2: 石家庄 | C2: 4862800 | D2: 5419000 | E2: 5529400 | F2: 8031600 | G2: 8211500
A3: 2 | B3: 唐 山 | C3: 6360900 | D3: 6625100 | E3: 8929800 | F3: 9214000 | G3: 11844800
A4: 3 | B4: 秦皇岛 | C4: 2078000 | D4: 2754100 | E4: 2238400 | F4: 2394600 | G4: 3143900
A5: 4 | B5: 邯 郸 | C5: 4010400 | D5: 5059400 | E5: 8809900 | F5: 5603500 | G5: 10079900
A6: 5 | B6: 邢 台 | C6: 3501300 | D6: 4144600 | E6: 3500800 | F6: 7198600 | G6: 3835300
A7: 6 | B7: 保 定 | C7: 7204200 | D7: 7344400 | E7: 11451200 | F7: 6995200 | G7: 7823200
A8: 7 | B8: 张家口 | C8: 3265800 | D8: 4503900 | E8: 3094300 | F8: 4713400 | G8: 5201900
A9: 8 | B9: 承 德 | C9: 2883200 | D9: 3793300 | E9: 3255200 | F9: 5346900 | G9: 5183700
A10: 9 | B10: 沧 州 | C10: 4359700 | D10: 5443400 | E10: 4771300 | F10: 7491000 | G10: 5914800
A11: 10 | B11: 廊 坊 | C11: 3119000 | D11: 5446700 | E11: 3170900 | F11: 5301900 | G11: 6066100
A12: 11 | B12: 衡 水 | C12: 5263200 | D12: 3012300 | E12: 3557700 | F12: 3901100 | G12: 8209700
A13: 12 | B13: 合计 | C13: =SUM(C2:C12) -> 46908500 | D13: =SUM(D2:D12) -> 53546200 | E13: =SUM(E2:E12) -> 58308900 | F13: =SUM(F2:F12) -> 66191800 | G13: =SUM(G2:G12) -> 75514800